{
  "jurisdiction_id": "us-51061",
  "name": "Fauquier County",
  "type": "county",
  "state": "VA",
  "unlisted_rule": "unknown",
  "code_version": "unknown",
  "conditional_zoning_unmapped": true,
  "sources": [
    "us-51061-gis-zoning"
  ],
  "districts": [
    {
      "district_code": "BP",
      "district_name": "BP",
      "family": "industrial",
      "parcel_specific": false,
      "geometry_ref": {
        "layer_url": "https://services.arcgis.com/oAoeYJ1kqmAwcEC2/arcgis/rest/services/Zoning_Districts_DL/FeatureServer/0",
        "field": "ZONECLASS",
        "value": "BP"
      }
    },
    {
      "district_code": "C-1",
      "district_name": "C-1",
      "family": "commercial",
      "parcel_specific": false,
      "geometry_ref": {
        "layer_url": "https://services.arcgis.com/oAoeYJ1kqmAwcEC2/arcgis/rest/services/Zoning_Districts_DL/FeatureServer/0",
        "field": "ZONECLASS",
        "value": "C-1"
      }
    },
    {
      "district_code": "C-2",
      "district_name": "C-2",
      "family": "commercial",
      "parcel_specific": false,
      "geometry_ref": {
        "layer_url": "https://services.arcgis.com/oAoeYJ1kqmAwcEC2/arcgis/rest/services/Zoning_Districts_DL/FeatureServer/0",
        "field": "ZONECLASS",
        "value": "C-2"
      }
    },
    {
      "district_code": "C-3",
      "district_name": "C-3",
      "family": "commercial",
      "parcel_specific": false,
      "geometry_ref": {
        "layer_url": "https://services.arcgis.com/oAoeYJ1kqmAwcEC2/arcgis/rest/services/Zoning_Districts_DL/FeatureServer/0",
        "field": "ZONECLASS",
        "value": "C-3"
      }
    },
    {
      "district_code": "CV",
      "district_name": "CV",
      "family": "commercial",
      "parcel_specific": false,
      "geometry_ref": {
        "layer_url": "https://services.arcgis.com/oAoeYJ1kqmAwcEC2/arcgis/rest/services/Zoning_Districts_DL/FeatureServer/0",
        "field": "ZONECLASS",
        "value": "CV"
      }
    },
    {
      "district_code": "GA",
      "district_name": "GA",
      "family": "other",
      "parcel_specific": false,
      "geometry_ref": {
        "layer_url": "https://services.arcgis.com/oAoeYJ1kqmAwcEC2/arcgis/rest/services/Zoning_Districts_DL/FeatureServer/0",
        "field": "ZONECLASS",
        "value": "GA"
      }
    },
    {
      "district_code": "I-1",
      "district_name": "I-1",
      "family": "industrial",
      "parcel_specific": false,
      "geometry_ref": {
        "layer_url": "https://services.arcgis.com/oAoeYJ1kqmAwcEC2/arcgis/rest/services/Zoning_Districts_DL/FeatureServer/0",
        "field": "ZONECLASS",
        "value": "I-1"
      }
    },
    {
      "district_code": "I-2",
      "district_name": "I-2",
      "family": "industrial",
      "parcel_specific": false,
      "geometry_ref": {
        "layer_url": "https://services.arcgis.com/oAoeYJ1kqmAwcEC2/arcgis/rest/services/Zoning_Districts_DL/FeatureServer/0",
        "field": "ZONECLASS",
        "value": "I-2"
      }
    },
    {
      "district_code": "M-G",
      "district_name": "M-G",
      "family": "other",
      "parcel_specific": false,
      "geometry_ref": {
        "layer_url": "https://services.arcgis.com/oAoeYJ1kqmAwcEC2/arcgis/rest/services/Zoning_Districts_DL/FeatureServer/0",
        "field": "ZONECLASS",
        "value": "M-G"
      }
    },
    {
      "district_code": "M-R",
      "district_name": "M-R",
      "family": "other",
      "parcel_specific": false,
      "geometry_ref": {
        "layer_url": "https://services.arcgis.com/oAoeYJ1kqmAwcEC2/arcgis/rest/services/Zoning_Districts_DL/FeatureServer/0",
        "field": "ZONECLASS",
        "value": "M-R"
      }
    },
    {
      "district_code": "M-T",
      "district_name": "M-T",
      "family": "other",
      "parcel_specific": false,
      "geometry_ref": {
        "layer_url": "https://services.arcgis.com/oAoeYJ1kqmAwcEC2/arcgis/rest/services/Zoning_Districts_DL/FeatureServer/0",
        "field": "ZONECLASS",
        "value": "M-T"
      }
    },
    {
      "district_code": "MDP",
      "district_name": "MDP",
      "family": "PD",
      "parcel_specific": true,
      "geometry_ref": {
        "layer_url": "https://services.arcgis.com/oAoeYJ1kqmAwcEC2/arcgis/rest/services/Zoning_Districts_DL/FeatureServer/0",
        "field": "ZONECLASS",
        "value": "MDP"
      }
    },
    {
      "district_code": "MU-BLTN",
      "district_name": "MU-BLTN",
      "family": "mixed",
      "parcel_specific": false,
      "geometry_ref": {
        "layer_url": "https://services.arcgis.com/oAoeYJ1kqmAwcEC2/arcgis/rest/services/Zoning_Districts_DL/FeatureServer/0",
        "field": "ZONECLASS",
        "value": "MU-BLTN"
      }
    },
    {
      "district_code": "PCID",
      "district_name": "PCID",
      "family": "PD",
      "parcel_specific": true,
      "geometry_ref": {
        "layer_url": "https://services.arcgis.com/oAoeYJ1kqmAwcEC2/arcgis/rest/services/Zoning_Districts_DL/FeatureServer/0",
        "field": "ZONECLASS",
        "value": "PCID"
      }
    },
    {
      "district_code": "PRD",
      "district_name": "PRD",
      "family": "PD",
      "parcel_specific": true,
      "geometry_ref": {
        "layer_url": "https://services.arcgis.com/oAoeYJ1kqmAwcEC2/arcgis/rest/services/Zoning_Districts_DL/FeatureServer/0",
        "field": "ZONECLASS",
        "value": "PRD"
      }
    },
    {
      "district_code": "R-1",
      "district_name": "R-1",
      "family": "residential",
      "parcel_specific": false,
      "geometry_ref": {
        "layer_url": "https://services.arcgis.com/oAoeYJ1kqmAwcEC2/arcgis/rest/services/Zoning_Districts_DL/FeatureServer/0",
        "field": "ZONECLASS",
        "value": "R-1"
      }
    },
    {
      "district_code": "R-2",
      "district_name": "R-2",
      "family": "residential",
      "parcel_specific": false,
      "geometry_ref": {
        "layer_url": "https://services.arcgis.com/oAoeYJ1kqmAwcEC2/arcgis/rest/services/Zoning_Districts_DL/FeatureServer/0",
        "field": "ZONECLASS",
        "value": "R-2"
      }
    },
    {
      "district_code": "R-4",
      "district_name": "R-4",
      "family": "residential",
      "parcel_specific": false,
      "geometry_ref": {
        "layer_url": "https://services.arcgis.com/oAoeYJ1kqmAwcEC2/arcgis/rest/services/Zoning_Districts_DL/FeatureServer/0",
        "field": "ZONECLASS",
        "value": "R-4"
      }
    },
    {
      "district_code": "RA",
      "district_name": "RA",
      "family": "agricultural",
      "parcel_specific": false,
      "geometry_ref": {
        "layer_url": "https://services.arcgis.com/oAoeYJ1kqmAwcEC2/arcgis/rest/services/Zoning_Districts_DL/FeatureServer/0",
        "field": "ZONECLASS",
        "value": "RA"
      }
    },
    {
      "district_code": "RC",
      "district_name": "RC",
      "family": "agricultural",
      "parcel_specific": false,
      "geometry_ref": {
        "layer_url": "https://services.arcgis.com/oAoeYJ1kqmAwcEC2/arcgis/rest/services/Zoning_Districts_DL/FeatureServer/0",
        "field": "ZONECLASS",
        "value": "RC"
      }
    },
    {
      "district_code": "RR-2",
      "district_name": "RR-2",
      "family": "agricultural",
      "parcel_specific": false,
      "geometry_ref": {
        "layer_url": "https://services.arcgis.com/oAoeYJ1kqmAwcEC2/arcgis/rest/services/Zoning_Districts_DL/FeatureServer/0",
        "field": "ZONECLASS",
        "value": "RR-2"
      }
    },
    {
      "district_code": "TH",
      "district_name": "TH",
      "family": "mixed",
      "parcel_specific": false,
      "geometry_ref": {
        "layer_url": "https://services.arcgis.com/oAoeYJ1kqmAwcEC2/arcgis/rest/services/Zoning_Districts_DL/FeatureServer/0",
        "field": "ZONECLASS",
        "value": "TH"
      }
    },
    {
      "district_code": "V",
      "district_name": "V",
      "family": "mixed",
      "parcel_specific": false,
      "geometry_ref": {
        "layer_url": "https://services.arcgis.com/oAoeYJ1kqmAwcEC2/arcgis/rest/services/Zoning_Districts_DL/FeatureServer/0",
        "field": "ZONECLASS",
        "value": "V"
      }
    }
  ]
}
